uid,headline,text,url,newspaper_uid,host,headline_tokens,text_tokens
e600f151300c736c4ee700fea87251d7,¿Quién es Deshaun Watson? El jugador de Cleveland Browns que enfrenta 22 demandas por abuso sexual,"Deshaun Watson fue fichado por los Cleveland Browns. Foto: ReutersLa NFL vive momentos polémicos debido al fichaje de Deshaun Watson por los Cleveland Browns por 230 millones de dólares mientras que el quarterback enfrenta un proceso judicial por 22 demandas de abuso sexual.Los Cleveland Browns adquirieron al mariscal de campo Deshaun Watson proveniente de los Houston Texans el pasado mes de marzo cuando el jugador ya había sido acusado de agresión sexual y conducta inapropiada.El proceso ha dado un nuevo giro y llevará a Deshaun Watson a tener que responder a las preguntas del juez para determinar si mantuvo relaciones con alguna de las 18 masajistas que firmaron un documento, según un fallo emitido el martes por un juez de Texas.Una solicitud que previamente había sido rechazada por el propio jugador asegurando que era “embarazoso” y que pertenecía a su vida privada y que no era relevante.Los abogados de las demandantes respondieron a esa negativa diciendo que las respuestas del jugador ayudarán a mostrar el patrón y los motivos de Deshaun Watson para buscar masajes con docenas de mujeres diferentes, muchas de las cuales conoció en las redes sociales.Hasta el momento, 22 mujeres presentaron demandas contra Watson, quien también es investigado por la NFL por acusaciones que describieron como “profundamente perturbadoras”.Watson había firmado una extensión de contrato por cuatro años y 156 millones con los Texans en 2020, pero solicitó un intercambio en enero de 2021 y no jugó la temporada pasada.¿Quién es Deshaun Watson?Deshaun Watson jugó cuatro temporadas con los Texans. Foto: AFPDeshaun Watson tiene 26 años, es considerado una de las estrellas ascendentes en la NFL, recibiría un contrato de cinco años por 230 millones de dólares garantizados con los Browns, según los reportes.Watson jugó para el equipo de Gainesville High School donde consiguió varios récords como el mayor número total de yardas (17 mil 134), de touchdowns (218), yardas por pase (13 mil 077) y pases para touchdown (155). ​ También corrió para 4 mil 057 yardas y 63 touchdowns.Tras su paso por el instituto, Watson decidió inscribirse en la Universidad Clemson, donde jugó para los Tigers.En 2017 fue seleccionado por los Houston Texans en la primera ronda, lugar 12 general del draft. El 12 de mayo de 2017, Deshaun Watson firmó un contrato de cuatro años por 13.84 millones, con un adelanto por firmar de 8.21 millones de dólares.Tras cuatro años con los Texans, Deshaun Watson tiene un porcentaje de efectividad de 67.8%, suma 14 mil 539 yardas, 104 pases para touchdown y 36 intercepciones.Tras una pausa la temporada pasada, el regreso a las canchas del jugador está rodeado de incertidumbre por la investigación que abrió la NFL para determinar si infringió la política de conducta personal de la liga.Cualquier transacción que se pueda producir “no tendría efecto en la investigación en curso y exhaustiva de la NFL sobre las graves acusaciones contra Deshaun Watson“, dijo el portavoz de la NFL, Brian McCarthy, en un comunicado a finales de marzo.Te recomendamos:Sólo para poliglotas: ¿Qué dice el himno de la Champions?Día Internacional del Deporte: ¿cuál serías según tu personalidad?Video¡Sorpresa! Villarreal le pega al Bayern Múnich",https://www.unotv.com/deportes/deshaun-watson-abuso-cleveland-browns-texans-nfl/,unotv,www.unotv.com,9,262
10be6a9845cbdf49c41f5aea4f29dc1e,¿Atlantis centroamericano?: arqueólogos encuentran una ciudad maya hundida en lago de Guatemala,"El Instituto Nacional de Antropología e Historia (INAH) colaboró en el hallazgo de las ruinas de una ciudad maya hundida en el fondo del lago Atitlán, en Guatemala, así lo reveló la Secretaría de Cultura de México.Los investigadores mexicanos colaboraron con arqueólogos de países como Bélgica, Francia, España y Argentina, quienes apoyaron al Ministerio de Cultura de Guatemala para realizar buceos con el objetivo de georreferenciar la zona.Ver más#DescubreMéxico 🇲🇽Colabora @INAHmx en la exploración de una ciudad maya sumergida en el lago Atitlán, en Guatemala🔸Se creó un modelo fotogramétrico para dar acceso virtual al sitio, fomentando su preservación dado su carácter sagrado.➡️ https://t.co/Rz4mQvNfx3 pic.twitter.com/M6vGvA7PiK— Secretaría de Cultura (@cultura_mx) April 4, 2022¿Cómo se encontró la ciudad maya en Guatemala?Los arqueólogos guatemaltecos recabaron información previa sobre los posibles restos de una ciudad maya en las profundidades del lago Atitlán, el cuerpo de agua más grande del país ubicado en un cráter volcánico en la zona montañosa de Sololá, al suroeste de Guatemala.Con el apoyo de otros países, las autoridades del país centroamericano lograron organizar una sesión de buceo especializada con la finalidad de identificar restos arquitectónicos de la cultura maya compartida entre el territorio guatemalteco y mexicano.¿Qué se encontró al fondo del lago Atitlán?En el lugar se recuperaron diversos objetos cerámicos y líticos debajo del lago Atitlán, cuyo sitio arqueológico data del periodo Preclásico Tardío maya, es decir, entre los años 400 y 250 antes de nuestra era, el cual está sumergido a una profundidad de entre 12 y 20 metros.Las exploraciones permitieron relocalizar y georreferenciar edificaciones, estelas y estructuras, generando con ello un nuevo mapa planimétrico y el sensoramiento remoto de gran parte de lago, recolectando muestras de limos del lago con la finalidad de entender la dinámica del sitio y estudiar el proceso de su hundimiento a lo largo del tiempo.“Con esta planimetría podemos hablar de un sitio que mide, al menos, 200 por 300 metros”.Helena Barba Meinecke, responsable de la Oficina Península de Yucatán de la Subdirección de Arqueología Subacuática (SAS) del INAHMiembros del INAH y de la comunidad de Santiago Atitlán participaron en el hallazgo de la ciudad maya / Foto: Twitter (@cultura_mx)De acuerdo con un comunicado del INAH, el objetivo principal es democratizar el patrimonio, por lo que también se abrió un parque ecológico. “La misión permitió sentar las bases para recomendar la creación de un centro cultural donde la gente conozca y recorra el sitio a través de reconstrucciones digitales”, precisó.¿Por qué colapsó la isla de la ciudad maya en Guatemala?La hipótesis sobre el colapso de la isla es que, dado que el lago Atitlán es un cráter volcánico que se levanta a más de mil 500 metros sobre el nivel del mar, pudo ser un evento natural vinculado con la actividad volcánica la que causó que la isla colapsara desde su parte inferior, aumentando al mismo tiempo el nivel del agua y orillando a los habitantes a huir.El hallazgo de los restos arquitectónicos de esta ciudad maya, que aún no ha sido identificada por los arqueólogos internacionales, ayudará a recabar mayor información para el entendimiento de las civilizaciones más antiguas de Centroamérica.TE PODRÍA INTERESAR…VideoCon una muestra del inicio de la era maya, así es el parque ecológico de Guatemala¡Tras ser patrimonio de la humanidad! Descubre frases básicas para aprender a hablar maya¡Orgullo en Yucatán! Nombran a lengua maya Patrimonio Intangible de la Humanidad",https://www.unotv.com/internacional/ciudad-maya-hundida-en-lago-de-guatemala-es-hallada-por-arqueologos/,unotv,www.unotv.com,8,288
6c32c88477ace7c71fa7544a11fe5d3a,Revelan el genoma humano más completo en 20 años; sólo falta un cromosoma,"Un grupo de científicos logró descifrar el 8% faltante en el genoma humano.Por primera vez en 20 años un grupo de científicos logró secuenciar el genoma humano más completo de toda la historia, pero aún queda un cromosoma por descubrir.La revista Science publicó la investigación de un equipo científico internacional, denominado Consorcio T2T, que completó el genoma más completo humano en la historia, ya que hasta el momento sólo se conocía el 92%.Los científicos lograron descifrar el 8% faltante gracias a la tecnología actual que ha permitido poner orden ese vació, y solo quedó pendiente un cromosoma.El doctor Diego Cortez, investigador del Centro de Ciencias Genómicas de la UNAM y experto en genómica humana, explica que este es un hallazgo histórico porque son “regiones de secuencias altamente repetitivas y muy variables”, ese 8% son cerca de 200 millones de bases, 200 millones de bases que se repiten variablemente. Ensamblar estas bases, es decir, ponerlas en orden, sería como intentar armar el cielo de “La noche estrellada”, de Van Gogh, con piezas del tamaño de un pixel.El Consorcio T2T presentó una secuencia completa de 3 mil 055 millones de pares de bases de un genoma humano, que incluye ensamblajes sin espacios para todos los cromosomas excepto Y, además corrige errores en las referencias anteriores, e introduce casi 200 millones de pares de bases de la secuencia genética que contienen mil 956 predicciones de genes.El doctor Luis Lozano, técnico académico y experto en ensamble de genomas del CCG de la UNAM, explica que el genoma que se secuenció en esta ocasión proviene del embrión de un embarazo molar, un tipo de embarazo no viable en el que el embrión, en lugar de tener una copia de su genoma de parte del padre y una de parte de la madre, tiene las dos copias del mismo progenitor. En este caso, de su mamá, haciendo que este genoma carezca de cromosoma Y.El nuevo descubrimiento abre las puertas a inimaginables desarrollos, especialmente en la medicina donde se podrá tener más conocimiento sobre las enfermedades genéticas, la diversidad humana y la evolución de la especie.Los investigadores dicen que los tramos recién secuenciados del genoma revelan puntos críticos para la evolución genética y de la historia del genoma humano.El análisis de la secuencia completa del genoma contribuirá significativamente a ampliar el conocimiento de los cromosomas y abre nuevas líneas de investigación. Esto ayuda a responder a preguntas de biología básica sobre cómo los cromosomas se segregan y dividen adecuadamente.¿Qué es el genoma humano?El genoma es el conjunto del material hereditario de un organismo, en él se contiene toda la información necesaria para que una persona pueda crecer y desarrollarse. Esta información es son transmitida de generación en generación, de padres a hijos. También ayuda a diagnosticar, tratar y prevenir enfermedades.El genoma completo de un humano es un texto de 3 mil 055 millones de pares de letras en el que cada letra es simplemente la inicial de un compuesto químico como carbono, hidrógeno, nitrógeno y oxígeno.La obtención de la secuencia completa del genoma humano comenzó en 2001 con la publicación del primer borrador. Dos años después se publicó una versión mejorada y más precisa, considerada hasta ahora como el genoma humano de referencia al tener secuenciado el 92% de los genes.Te recomendamos:La danza de los huracanes: ¿qué es el efecto Fujiwhara y qué tan destructivo es?¡Por fin! Google introduce reacciones con emoji en Google Docs, así funcionarán¡Todo a un solo clic! Las mejores apps para las vacaciones: vuelos y hospedajes baratos",https://www.unotv.com/ciencia-y-tecnologia/revelan-el-genoma-humano-mas-completo-en-20-anos-solo-falta-un-cromosoma/,unotv,www.unotv.com,8,301
5ea4796598480567d4457e777679a3bd,¡Cuidado! Niños replican acciones de Huggy Wuggy; personaje de terror que se ha viralizado,"El personaje de terror “Huggy Wuggy” está causando que niños deseen imitarlo. FOTO: Twitter @mobgamesstudiosAutoridades y padres de familia de Gran Bretaña alertan sobre el peligro que representa para los niños el personaje azul “Huggy Wuggy” del juego “Poppy Playtime” de Mob Games, reportan casos de niños que quieren llevar a la realidad lo que hace el muñeco asesino.¿Quién es “Huggy Wuggy”?Este personaje es un muñeco de peluche azul con una gran cantidad de dientes afilados que aterroriza al jugador de “Poppy Playtime”, amenaza con abrazarlo hasta quitarle el último aliento, en una juguetería abandonada donde el jugador tiene que escapar.Aunque el videojuego no está orientado para los niños, se ha hecho muy popular entre los más jóvenes, al grado que la venta de este muñeco fue alta en épocas decembrinas en gran parte del mundo.Ver másEl huggy wuggy que me saluda desde la vitrina cada q vuelvo de la universidad ea pic.twitter.com/GU63HXBs5p— ✨ Mikö ✨OPEN COMS (@mikochan_dm2) April 1, 2022Alerta contra personajeLa policía del condado de Dorset en Gran Bretaña emitió una advertencia para informar que se han localizado casos de menores que han intentado llevar a la realidad algunas de las acciones que realiza “Huggy Wuggy”.Los cortos del personaje y de personas jugando este juego se han hecho virales en las redes sociales atrayendo miles de vistas en Youtube y Tik Tok, videos que quedan expuestos a los menores.Los padres de familia alertan que el contenido de los videos relacionados con el “Huggy Wuggy”, contienen mensajes que no deberían ser vistos por los niños, además de ser pasado por alto en diversas plataformas por parecer un contenido inofensivo.La empresa Mob Games ha informado en sus redes sociales que el juego en su primer capítulo está disponible para sistemas móviles, lo que hará más popular al personaje, por lo que se recomienda a los padres de familia revisar el contenido que ven y juegan sus hijos.TE PODRÍA INTERESAR…Rusia da ultimátum a Ucrania y hace este anuncioYa cayó: hombre golpea auto y causa pánico a niña; ve videoVideoJusticia para Hugo: asesinan a joven de 15 años en fiesta; ésta es su historia",https://www.unotv.com/virales/huggy-wuggy-muneco-asesino-podria-ser-imitado-por-ninos/,unotv,www.unotv.com,8,188
f463dba8b41f36479367ac10f9c17184,El INE y el Tribunal son fundamentales para el país,"Luis Rubio explica que México es un país que ha cambiado mucho en las últimas décadas, aunque no todos los cambios han sido para mejorar a toda la población, sí se han abierto oportunidades que nunca antes se habían tenido, sobre todo en materia de democracia.Nuestro analista asegura que el país se gobernaba hace décadas con “un gobierno centralizado controlador desde el centro del país hacia todo el resto de la nación poco a poco se fue descentralizando y se fueron abriendo oportunidades”.“Hubo muchos conflictos electorales sobre todo en los años 80 y 90 y por eso la legislación electoral llevó a cambios dramáticos en los 90 se aprobó una legislación electoral en la llamada reforma de 1996 que permitió equidad y condiciones para la competencia entre los partidos, pero no sólo eso también se profesionalizó todo el esquema de la administración de las elecciones”.Luis RubioLuis Rubio señala que se creó un tribunal electoral para resolver los problemas de la desconfianza entre los partidos que era tan grande y se incorporaron mecanismos para dar seguridad.El nuevo sistema democrático ha permitido que exista alternancia en el poder, “tenemos instituciones electorales excepcionales muchos de los consejeros o exconsejeros han sido contratados por diversos países del mundo para asesorar”, señala Rubio.Luis Rubio indica que si uno ve el desastre que tiene Estados Unidos en el sentido de la administración de las elecciones, es motivo de orgullo tener instituciones como el INE y el Tribunal Electoral.“Pocas instituciones han aguantado el embate de gobiernos difíciles como ha sido el INE y el tribunal, es fundamental que los mexicanos entendamos que la dos instituciones que son clave para el estabilidad de política del país”.Luis RubioTe recomendamos:VideoSe viene la revocación de mandato, ¿qué esperar?VideoEl banco de EU hará modificaciones que afectarán a MéxicoVideoEstados Unidos y Venezuela un ejemplo de la redefinición geopolítica",https://www.unotv.com/opinion/luis-rubio/ine-tribunal-son-fundamentales-para-el-pais/,unotv,www.unotv.com,4,143
4e3fa289838dd1aba16cd98179874fd2,"“Todavía falta”: ¿Evaluna Montaner y Camilo ya son papás?, Ricardo Montaner lo desmiente","¿Evaluna y Camilo recibieron a su primera hija llamada Índigo? Ricardo Montaner pide calma / Foto: AFPEl primer bebé de Evaluna Montaner y Camilo ya habría nacido y se trataría de una niña llamada Índigo, la integrante más joven de la familia Montaner, aunque el propio Ricardo Montaner desmintió la noticia en Twitter, asegurando que su hija aún no da a luz.Ver másCalma … todavía falta ..!— Ricardo Montaner (@montanertwiter) April 6, 2022Los dos artistas compartieron todo el proceso de su embarazo en redes sociales. Los primeros reportes indican que la pareja finalmente recibió a una niña, pues tanto Camilo como Evaluna decidieron no saber por anticipado el sexo de su bebé.Ver más¿Por qué se llama Índigo la hija de Camilo y Evaluna?Índigo fue el nombre elegido por sus padres desde varios meses antes de su nacimiento, esto debido a que es un nombre neutro poco común que corresponde tanto a niñas como a niños.Fue el 13 de octubre de 2021 cuando los dos cantantes anunciaron a través de un video que se convertirían en papás, sin ocultar su emoción por la noticia.“¡Vamos a ser papás!  No veíamos la hora de compartir con ustedes la noticia más hermosa que hemos recibido. Dios nos escogió para ser los papás de Índigo y nos sentimos muy afortunados de verlx llegar y florecer. Los amamos y gracias por acompañarnos en cada paso siempre”Evaluna MontanerVer másEl pasado 31 de marzo, Ricardo Montaner adelantó que los dos jóvenes artistas planearon el nacimiento del bebé en casa y con ayuda de una partera, en lugar de acudir a un hospital.Índigo, la canción de Evaluna y CamiloCinco meses antes del nacimiento de Índigo, Camilo y Evaluna Montaner estrenaron una colaboración con el nombre de su bebé, aún sin saber su sexo.“Cómo puede ser que uno sueñe con alguien que ni siquiera ha conocido. No sé si es posible, pero yo ya llevo mucho tiempo soñando contigo”Evaluna y CamiloEl intérprete de “Vida de Rico” se mostró ilusionado y sumamente cercano al embarazo de la hija de Ricardo Montaner, destacando en sus redes sociales los mensajes de admiración y agradecimiento a su pareja. “Toda mi admiración por ella. Por ser columna vertebral de este hogar que somos”, expresó.TE PODRÍA INTERESAR…“Will Smith exageró”: Jada Pinkett Smith dice que no pidió que la defendieran¿Ya con novio? Filtran fotos de Ángela Aguilar y su pareja; es 15 años mayor que ella¿Quién es Gussy Lau, el novio de Angela Aguilar?",https://www.unotv.com/entretenimiento/evaluna-montaner-y-camilo-ya-son-papas-se-confirma-que-indigo-es-nina/,unotv,www.unotv.com,8,214
4022953ddda482362e968b407cc581db,"¡Por fin! Google introduce reacciones con emoji en Google Docs, así funcionarán","Progresivamente tendrás la opción de agregar emojis en Google Docs / Foto: Getty ImagesGoogle dejó en el pasado sus fallas de seguridad y actualmente se encuentra en proceso de introducir una nueva función en su procesador de texto ‘online’, Google Docs, permitiendo expresar reacciones a palabras o frases de los documentos mediante el uso de emojis.¿Cómo se podrá agregar emojis a Google Docs?Para acceder a las reacciones en Google Docs, deberás seguir las siguientes indicaciones:Desplazar el cursor sobre una palabra del documentoDarle click en el icono ‘Agregar reacción‘.Una vez se hayan establecido las preferencias de Google Docs, estas se trasladarán directamente a Google Chat.Google Docs permitirá a sus usuarios interactuar a través de emojis / Foto: Getty ImagesEstos emojis también se pueden modificar por género y tienen opciones neutrales de género. En este caso, Google ha especificado que las preferencias y tono de piel se guardan individualmente con cada emoji.¿Qué hace falta tener para acceder a esta opción?Según ha explicado la compañía en su portal oficial de actualizaciones, está poniendo a disposición de los usuarios Emoji 14.0, un conjunto de emojis, incluidos en la última versión de Google Docs, que cuenta con varias opciones para reflejar estados de ánimo.Si el usuario escoge un emoji con un determinado color de piel, este vendrá también reflejado en el servicio de mensajería de Google. No obstante, ambas aplicaciones se pueden utilizar para actualizar las preferencias de los emojis.¿A partir de cuándo estará la opción de los Emojis en Google Docs?Los dominios de liberación rápida comenzaron el 5 de abril con 15 días de visibilidad, mientras que el lanzamiento programado comenzará el próximo 20 de abril, igualmente, con un espacio de dos semanas para su visibilidad.¿En qué momento podré comenzar a utilizar los emojis en Google Docs? A partir del 20 de abril de 2022 para Google Workspace Essentials, Business Starter, Business Standard, Business Plus, Enterprise Standard y Enterprise Plus.Esta característica, que ya está disponible en otras aplicaciones como Slack, Instagram o iMessage, y en la que WhatsApp lleva trabajando desde hace unos meses, da la oportunidad a los usuarios de opinar sobre algo sin tener que escribir una palabra o una frase.TE PODRÍA INTERESAR…¡Todo a un solo clic! Las mejores apps para las vacaciones: vuelos y hospedajes baratosCientíficos logran mapear completamente uno de los “huesos” de la Vía Láctea por primera vezMLB The Show 22 ¿El mejor juego de deportes en su tipo?",https://www.unotv.com/ciencia-y-tecnologia/google-introduce-reacciones-con-emoji-en-google-docs-asi-funcionaran/,unotv,www.unotv.com,9,215
00145e9dd41559db18e42cc5fd69745e,Volcadura de tráiler provoca caos vial en Circuito Interior; ve RUTAS alternas,"Debido al accidente, el servicio del Metro se vio afectado y se registró severa carga vehicular. Foto: @SGIRPC_CDMXEl choque y volcadura de un tráiler en Circuito Interior a la altura del Peñón de los Baños, con dirección al Aeropuerto Internacional de la Ciudad de México, provoca severa carga vehicular en la zona al Oriente de la Ciudad de México (CDMX).Debido al accidente registrado durante la mañana de este jueves, autoridades capitalinas pidieron salir con tiempo y tomar rutas alternasVer másUn tráiler que circulaba en Emiliano Zapata, col. Pensador Mexicano, @A_VCarranza, perdió el control quedando ladeado un contenedor en estructura y malla perimetral de las instalaciones del @MetroCDMX de la Línea 5, entre las estaciones Oceanía y Terminal Aérea. pic.twitter.com/kFAvvm9m6Q— Secretaría de Gestión Integral de Riesgos y PC (@SGIRPC_CDMX) April 7, 2022Ver másAlrededor de las 7:00 hrs, el servicio se normalizó después de que servicios de emergencia lograran remover el trailer. #AlertaVial pic.twitter.com/0ulx8enuEv— Uno TV (@UnoNoticias) April 7, 2022¿Qué paso en Circuito Interior?Durante la mañana, el conductor de un tráiler, al circular sobre carriles centrales de Circuito Interior, a la altura de Peñón de los Baños, perdió el control del pesado vehículo e impactó la caja que transportaba contra el muro de contención de la Línea 5 del Sistema de Transporte Colectivo Metro (STC).Debido al choque en la interestación Oceanía-Terminal Aérea, el Metro informó, a través de sus redes sociales, alrededor de las 6:33 horas, que no había servicio desde Eduardo Molina a Pantitlán.Sin embargo, se implementó servicio provisional desde Consulado a Politécnico, mientras personal laboraba en la zona del siniestroVer más#AvisoMetro: Se normaliza el servicio en todas las estaciones de la Línea 5, la circulación de los trenes es continua. #MovilidadCDMX https://t.co/JBVqE742hp— MetroCDMX (@MetroCDMX) April 7, 2022¿Cuáles son las rutas viales alternas?Debido al accidente y la carga vehicular, el Centro de Orientación Vial de la Secretaría de Seguridad Ciudadana de la CDMX informó que las alternativas viales se encontraban en Eje 3 Oriente y la Avenida 508.No dejes de leer: Mejor lleva paraguas, habrá probabilidad de lluvias y chubascos en la CDMX este 7 de abrilVer más06:58 #PrecauciónVial | Servicios de emergencia laboran en Circuito Interior a la altura de Peñón de los Baños dirección al AICM. #AlternativaVial | Eje 3 Oriente y Av. 508. pic.twitter.com/PVSpsWQfVg— OVIAL_SSCCDMX (@OVIALCDMX) April 7, 2022Posteriormente, a las 7:10 horas, el STC dio a conocer que el servicio en todas las estaciones de la Línea 5 se normalizaba, mientras las acciones para retirar el tráiler volcado sobre Circuito Interior, en las inmediaciones de la colonia Pensador Mexicano, continúan.Ver más07:38 #PrecauciónVial | Continúa labor de servicios de emergencia en Circuito Interior a la altura de Transvaal con dirección al AICM. #AlternativaVial | Eje 3 Oriente y Av. 508. pic.twitter.com/1ZyBO3mBTe— OVIAL_SSCCDMX (@OVIALCDMX) April 7, 2022TE PUEDE INTERESAR:¿Es apto para niños? Conoce Poppy Playtime, el aterrador juego de Huggy Wuggy¿Qué son las chiquitecas y por qué son peligrosas?“Todavía falta”: ¿Evaluna Montaner y Camilo ya son papás?, Ricardo Montaner lo desmiente",https://www.unotv.com/estados/ciudad-de-mexico/circuito-interior-con-carga-vial-por-volcadura-de-trailer-con-direccion-al-aeropuerto/,unotv,www.unotv.com,10,259
