uid,headline,text,url,newspaper_uid,host,headline_tokens,text_tokens
e1660bf143bb68c796b15c4eafa3d3c8,Así puedes saber en cuánto tiempo te cae tu saldo a favor del SAT,"El Servicio de Administración Tributaria (SAT) apoya a los derechohabientes con la devolución del saldo favor al momento de realizar su declaración de impuestos.Esto ocurre cuando al efectuar el cálculo de tus impuestos, resulta que pagaste más de lo que debías, por lo que puedes solicitar ante el SAT que te sea devuelta la cantidad.Pero ¿Cuándo cae el saldo a favor?El plazo natural de devolución del saldo a favor consta de 40 días, siempre y cuando hayas cumplido con el papeleo debido.“Las devoluciones deberán efectuarse dentro del plazo de los 40 días hábiles siguientes a la fecha en que se presentó la solicitud ante la autoridad fiscal”.Deberás tener a la mano tu e-firma o RFC y contraseña. Foto: Freepik¿Cómo solicitar la devolución del saldo a favor?Para acceder a la devolución, si es que te corresponde, necesitas:Dar clic en el botón iniciar en la página del SATIngresar con e-firma o RFC y contraseñaLlenar los datos solicitados en el formato electrónicoIngresar los archivos con los documentos del trámite escaneadosFirma y enviar el trámite con apoyo de tu firma electrónicaGuardar o imprimir tu acuse de recibo electrónicoDar seguimiento a tu devolución en el contenido relacionado “Consulta tu devolución automática”TE PUEDE INTERESAR: ¡Ojo! Ésta es la fecha y hora límite para presentar tu declaración anual de personas físicas ante el SAT¿Qué hacer si no recibes tu devolución?Cuando el saldo declarado no sea devuelto total o parcialmente, debes solventar las inconsistencias en el Portal del SATNecesitas tu RFC y contraseña para el acceso al Portal, así como la e.firma para que se genere automáticamente tu solicitud de devolución vía el Formato Electrónico de Devoluciones (FED)El SAT indica que las declaraciones con saldo a favor autorizadas están sujetas a:La compensación de oficio de los créditos fiscales firmes que tengas a cargoInconsistencias en tu cuenta bancaria CLABE Sin embargo, no se considera una devolución automática cuando:La solicitud de devolución es a través del Formato Electrónico de DevolucionesSi marcas la opción de compensación en la Declaración AnualSi te encuentras en el catálogo de incumplidos publicado en este PortalPresentes una declaración distinta al ejercicio que correspondaTE PODRÍA INTERESAR…VideoNegocios¿Tienes dudas para cumplir obligaciones fiscales? Ve cómo te puede apoyar el SAT de forma gratuita  Negocios¿Presentarás tu Declaración Anual al SAT? Tips para contratar a un buen contadorVideoNegocios¿Vas a hacer tu declaración anual? Ve quiénes deben presentarla ante el SAT",https://www.unotv.com/negocios/devolucion-del-saldo-a-favor-del-sat-conoce-en-cuanto-tiempo-se-te-regresa/,unotv,www.unotv.com,9,200
6cff4e4b760d5a610ef01c33ae30776c,¿Tienes dudas para cumplir obligaciones fiscales? Ve cómo te puede apoyar el SAT de forma gratuita  ,"Este mes se presenta la declaración anual 2022, que corresponde al ejercicio fiscal 2021, para personas físicas, pero en ocasiones existen dudas, por ello, el SAT (Servicio de Administración Tributaria) cuenta con algunas opciones para poder esclarecerlas.¿Qué opciones de orientación puedes obtener en el SAT?Mediante redes sociales puedes preguntar directamente alguna duda a la cuenta de Twitter de la dependencia que es @SATMX en donde te pueden brindar ayuda. En dado caso que necesites algo más preciso, puedes consultar de manera telefónica o por chat.Orientación telefónica: para poder ser atendido tienes que marcar al 55 627 22 728 desde cualquier parte de país. En el menú podrás elegir información sobre:Marca 0: Orientación del nuevo Régimen para Personas Físicas y Morales que entra en vigor a partir del 1 de enero de 2022.Marca 1: Inscripción al Registro Federal de ContribuyentesMarca 2: Servicios de Contraseña y Cédula de Identificación Fiscal; podrás obtener información para la generación de contraseña por internet e información para obtener la Cédula de Identificación Fiscal.Marca 3: Orientación respecto al Régimen de Incorporación Fiscal, Comprobantes Fiscales y Plataformas Digitales, además, de apoyo en temas de impuestos federales para Personas Físicas.Marca 4: Orientación respecto a mi contabilidad y dudas del llenado de declaraciones y te asesorarán para presentarlas correctamente.Marca 7: Comercio exterior, en este apartado te pueden asesorar sobre trámites de Programa Héroes Paisanos; Padrón de Importadores y Exportadores e importación temporal de vehículos.Marca 8: Quejas, Denuncias y SugerenciasMarca 9: Cobranza y aclaración de pagos atípicos, incumplimiento de declaraciones y pagos, así como mensajes de texto en su celular.El servicio telefónico es de lunes a viernes de 8:00 a 18:30 horas y sábado de 8:00 a 14 horasChat del SATOtra opción que puedes usar es el chat uno a uno del SAT, en donde podrás preguntar sobre consultas concretas de manera confidencial y gratuita. Recuerda que para usar el servicio es necesario que tengas en cuenta lo siguiente:Eres responsable de tus manifestaciones y todo acto que realices u omitas en la sesión de ChatSe prohíbe el uso de lenguaje ofensivoSerás atendido en una misma sesión sobre las consultas que tengan relación con tu situación fiscal. Cuando correspondan a una situación fiscal diferente, será necesario que abras otra sesión.  Se recomienda seleccionar el tema al que corresponde tu consultaEn la conversación de Chat no se realiza cálculo de impuestos ni llenado de formatosLa aplicación se actualiza automáticamente sin necesidad de algún evento de tu parte (no actualizar, de lo contrario se abrirá una nueva ventana).Se solicitará tu nombre completo, correo electrónico, número telefónico con lada, horario en que te puedan contactar.El servicio del chat uno a uno del SAT trabaja en el horario de 8:00 a 18:30 horas de lunes a viernes. Recuerda que este mes se presenta la declaración anual para personas físicas.TE PODRÍA INTERESAR…VideoPrecios de gas LP por kilo y litro vigentes del 3 al 9 de abrilNo te dejes engañar: sólo así puedes comprar boletos para el Mundial¡Cheaper Mister!: Estadounidenses compran gasolina en México más barata",https://www.unotv.com/negocios/sat-recibe-asesoria-gratuita-para-cumplir-obligaciones-fiscales/,unotv,www.unotv.com,11,260
9e239faae5e6bcb4f75756b41abc37c6,¡No lo dejes pasar! Conoce los pasos para el canje de placas y tarjeta de circulación en Zacatecas,"La vigencia para hacer el canje de placas y tarjeta de circulación en Zacatecas es hasta el próximo 31 de mayo. Foto: Facebook Secretaría de Finanzas de ZacatecasCon motivo del canje de placas y tarjeta de circulación en Zacatecas, desde este lunes, autoridades de la entidad informaron del arribo del primer lote de láminas, así como posteriormente, detallaron los pasos para llevar a cabo el trámite.Canje de placas y tarjeta de circulación en Zacatecas, ¿qué se sabe del trámite?A través de una publicación compartida en su cuenta oficial de Facebook, la Secretaría de Finanzas de Zacatecas dio a conocer del arribo del primer lote de placas vehiculares a las instalaciones de dicha dependencia.Asimismo, la Secretaría detalló que estas nuevas láminas de identificación vehicular cuentan con tres nuevos sistemas de seguridad, así como que la plataforma para registrar una cita y realizar el trámite está habilitada desde este martes.Ver más¿Cuáles son los pasos para el canje de placas y tarjeta de circulación en Zacatecas?Posteriormente, la dependencia zacatecana dio a conocer los detalles y pasos para llevar a cabo el canje de placas y tarjeta de circulación.De inicio, se debe solicitar una cita en la oficina de Recaudación de Renta más cercana, a través de la plataforma http://portaltributario.zacatecas.gob.mx/citas/.Como segundo paso, se debe contar con el recibo de pago y presentarlo para que pueda ser acreditadoUna vez que la Secretaría de Finanzas lo valide, entregará un acuse de cita con una fecha posteriorYa que se asigne una fecha, en la oficina de Recaudación de Renta se debe presentar: Acuse de cita, recibo de pago, juego de placas anteriores para hacer el canje, la tarjeta de circulación y una credencial de elector o identificación oficial.Cabe recordar que la Secretaría de Finanzas agregó que este trámite debe realizarse desde el 1 de abril hasta el próximo 31 de mayo.Ver más¿Con placas vencidas, se puede circular en otros estados?Con el periodo vacacional, la dependencia informó que ante la extensión de la vigencia de placas y tarjeta de circulación, aquellos autos con placas vencidas pueden circular en otros estados del país.No dejes de leer: Violencia vicaria: qué es y por qué Zacatecas es el primer estado en tipificarlaDe la misma manera, la dependencia enfatizó que mientras permanezca este decreto, autoridades de tránsito en la entidad “no podrán considerar como infracción el que las placas metálicas de circulación e identificación vehicular en el estado de Zacatecas, se encuentren vencidas”.Ver másTE PUEDE INTERESAR:Choque de Metrobús en Paseo de la Reforma deja al menos 65 heridosGomita, Edgar Vivar y Julio Preciado: famosos que se han hecho bypass¡Un Goya para la UNAM! Es la segunda mejor de Latinoamérica y una de las 105 mejores del mundo",https://www.unotv.com/estados/zacatecas/canje-de-placas-y-tarjeta-de-circulacion-en-zacatecas-pasos-para-el-tramite/,unotv,www.unotv.com,9,224
d04851f07c05c472d3616f837e41e207,"¡Ah, qué CDMX! Tras calor, llegarían lluvias con granizo y actividad eléctrica del 7 al 10 de abril","Se esperan lluvias en CDMX del jueves 7 al domingo 10 de abril de 2022, acompañadas de granizo y actividad eléctrica. Foto: Cuartoscuro.Del jueves 7 al domingo 10 de abril 2022, la Secretaría de Gestión Integral de Riesgos y Protección Civil (SGIRPC) de Ciudad de México (CDMX) prevé lluvias que llegarían acompañadas de granizo y actividad eléctrica, tras los últimos días de intenso calor.Ver más⏺️Aviso especialSe prevén lluvias del 7 al 10 de abril, en algunas regiones acompañadas de actividad eléctrica y caída de granizo.Además, se prevé disminución en la temperatura 🌡máxima de 23 a 24 °C; 19 a 20 °C en las partes altas de la ciudad.#LaPrevenciónEsNuestraFuerza pic.twitter.com/iLSe8RSkN2— Secretaría de Gestión Integral de Riesgos y PC (@SGIRPC_CDMX) April 6, 2022En una infografía difundida en Twitter, la SGIRPC de CDMX dijo que del jueves 7 al domingo 10 de abril, las temperaturas descenderán desde los 23 a 24 grados centígrados (°C) hasta los 19 a 20 °C “en las partes altas de la” capital, en contexto de intensas lluvias.Lluvias en CDMXPrecipitaciones serán más probables en horas de la tardeDel jueves 7 al domingo 10 de abril habría granizo y actividad eléctricaAnte lluvias con granizo y actividad eléctrica, la SGIRPC de CDMX recomendó a la ciudadanía reportar al 911 el drenaje obstruido; portar paraguas e impermeable, y permanecer atentos a comunicados del Sistema de Alerta Temprana Multi-Riesgo de la dependencia capitalina.Ver másEn esta época de calor, sigue las recomendaciones:🟡Utiliza gafas y gorra🟡Usa bloqueador🟡Mantente hidratado🟡No exponerse al sol por tiempo prolongado🟡Evita comer en la vía pública, los alimentos se descomponen rápidamente#LaPrevenciónEsNuestraFuerza pic.twitter.com/mGVMO4K0jN— Secretaría de Gestión Integral de Riesgos y PC (@SGIRPC_CDMX) April 6, 2022Pese a lluvias del 7 al 10 de abril en CDMX, las altas temperaturas persistirán en los próximos días, por lo que la SGIRPC sugirió evitar exponerse a los rayos del sol de las 11:00 a 16:00 horas, vestir ropa clara y de color claro, aumentar el consumo de líquidos, consumir alimentos frescos.TE PODRÍA INTERESAR…Eiza González tiene aterrorizada a la señora que trabaja en su casaAlfredo Adame recibe burlas de su novia, Magaly Chávez, por su pleito con abogado de Carlos TrejoVideo¡Sol, arena y mar! Britney Spears se graba sin sostén mientras juega en la playa",https://www.unotv.com/estados/ciudad-de-mexico/lluvias-en-cdmx-del-7-al-10-de-abril-tras-intenso-calor-habria-granizo-y-actividad-electrica/,unotv,www.unotv.com,9,176
514d616a0990abd8b7c3b49a80059d74,"¿Quién es Gussy Lau, el novio de Angela Aguilar?","La química que hubo entre Gussy Lau y Ángela Aguilar fue más fuerte que todo. Foto: SACMLa familia Aguilar tiene todos los reflectores, luego de que se filtraran fotos y se diera a conocer la relación de Ángela con Gussy Lau, es por eso que en Uno TV te decimos quién es.René Humberto Lau Ibarra nació el 6 de junio de 1988 en Culiacán, Sinaloa. Tiene dos hermanos Jesús Octavio y Brandon.Al hijo de Humberto Lau Arias y Martina Araceli Ibarra Rojo siempre le gustó la música y la composición, pero arrancó profesionalmente dándole grandes éxitos a artistas como Julión Álvarez (“Esta noche se me olvida”), Christian Nodal (“De los besos que te di”) y Calibre 50 (“A las cuántas decepciones”).A finales de marzo de 2021, Gussy Lau fue contratado por Pepe Aguilar como compositor de Equinoccio Récords y en una dinámica en sus redes sociales, explicó por qué no tendría una relación con alguna integrante de la familia Aguilar.“Ni con Ángela, ni con Aneliz, y si fuera mujer ni con Leonardo. ¿Por qué?, muy sencillo: Pepe Aguilar es mi jefe, lo he visto, mide 2 metros y le llegas a hacer algo a alguno de sus hijos, ¡cállate!”Ver másEsto decía Gussy Lau sobre relacionarse con Ángela Aguilar antes de la filtración de unas fotos donde supuestamente están romanceando. pic.twitter.com/zf5qrvGANN— Alfredo Molina (@AlfredoRadio) April 5, 2022Pero al parecer la química que hubo entre Gussy Lau y Ángela Aguilar fue más fuerte para que el compositor confirmara su relación.Ver más#GussyLau confirma relación con #AngelaAguilar . Al parecer tiene la aprobación de los padres . Yo ya ni sé que creer 🤷🏻‍♀️ #PepeAguilar pic.twitter.com/sQCjzj3aOc— JUANGABRIELA JACKSON 🦋 (@YoZhoy) April 7, 2022¿Cuántas canciones ha compuesto Gussy Lau?Según la Sociedad de Autores y Compositores de México (SACM),  Gussy Lau tiene 65 canciones registradas:A cuánto me quedeA las cuántas decepcionesA medio paso de rendirmeAhí donde me venAl final quede sin tiAquí abajoAsí quería mirarteComo en los viejos tiemposCómo me arrepientoCómo no va ser amorComo quiera sigo vivoDe los besos que te diDe mi lado izquierdoDespués de tiDoble llaveEl amor de antesEl primer lugarEn un día como hoyEn un día como hoy (version banda)Entre ella y túEso seríamos nosotrosEsta noche se me olvidaEstuveFuimosHa de ser porque me extrañasImpasibleLa estoy pasando malLa última y nos vamosLos principios son bonitosMe duele más a míMe equivoqué en amarteMírameMíranos ahoraNace un borrachoNo la cambio por ningunaNo puedo andar contigoNo te contaron malNo te vez enamoradaNomás le muevoNomás me faltas túPara no acordarme de ellaPara olvidarmePara olvidarme de tiPerdónamePero que mal me fuePor un segundoPor qué tuviste que marcharteQue sigue sin tiQué tal si volvemosQuisiera enamorarmeSi se acabara el mundoSi usted fuera yoSoñéTambién tú te equivocasTe necesitoTraté de todoTres botellasTres recuerdosTú te lo pierdesVengo a rogarteY no eras tú quien decíaY qué les vamos a decirY si se quiere irYa duele menosYo no sirvo para amarteTE PODRÍA INTERESAR…VideoAdicción a los videojuegos ya es una enfermedad según la OMS, ve señales de alerta¿Será? Sonic se ubica como el personaje más popular de los videojuegosRescatan a niño enganchado con videojuego “Free Fire” en Oaxaca",https://www.unotv.com/entretenimiento/quien-es-gussy-lau-el-novio-de-angela-aguilar/,unotv,www.unotv.com,5,274
28964f5a924601d64b3cd9432b318404,"¡Guau, guau! Nuevo León prohíbe mutilaciones estéticas y tatuajes en animales de compañía","Congreso de Nuevo León aprobó sancionar mutilaciones estéticas en perros y gatos. Foto: Cuartoscuro/ArchivoEn Nuevo León, el Congreso aprobó sancionar mutilaciones estéticas en perros y gatos, como cortarles la cola, las orejas o tatuarlos.¿Qué se sabe de la prohibición en Nuevo León a mutilaciones estéticas en perros y gatos?El Congreso de Nuevo León aprobó, por unanimidad de votos, la reforma a la Ley de Protección y Bienestar Animal, con el fin de sancionar a quien incurra en mutilaciones estéticas en los animales de compañía.De esta forma, se podrá sancionar a los dueños de perritos y gatos, en su mayoría, que perforen, mutilen o tatúen a sus animales de compañía, bajo el argumento de evitar daños físicos en las especies. El Pleno legislativo aprobó este miércoles la reforma a la Ley de Protección y Bienestar Animal para la Sustentabilidad del estado.Con esta reforma, el artículo 27 quedará de la siguiente forma:“Será sujeto de sanción cualquier acto de maltrato o crueldad contra los animales, cuando afecten su salud o apariencia física, altere su comportamiento o instinto natural o le causen la muerte. Salvo que sea por cuestiones de salud, control natal, identificación o marcaje de la especie de que se trate, o sea por motivos de piedad, lo cual deberá acreditarse”.Las sanciones no están especificadas; sin embargo, las penas por incurrir en un delito marcado en la Ley de Protección y Bienestar Animal para la Sustentabilidad del Estado de Nuevo León van desde una multa de 50 a 10 mil veces la Unidad de Medida (desde 7 mil 145.16 pesos hasta un millón 429 mil 32. 94 pesos), así como los cierres de los lugares o clausuras.La iniciativa la impulsó el coordinador legislativo de los diputados del Partido Revolucionario Institucional (PRI) en el estado, Heriberto Treviño, junto con la activista Claudia Tapia. En el texto se estableció que la crueldad animal, parcial o total contra el cuerpo de los seres vivos, será sancionada.Ver másA propuesta de nuestro Coordinador, el Dip. @heriberto_tc, hoy el Congreso del Estado aprobó reformas a la Ley de Protección y Bienestar Animal, para sancionar las mutilaciones estéticas parciales o totales que se hagan en las mascotas. pic.twitter.com/62Fhnvk55L— Diputados PRI NL (@DiputadosPRI_NL) April 6, 2022",https://www.unotv.com/estados/nuevo-leon/nuevo-leon-congreso-aprobo-sancionar-mutilaciones-esteticas-en-perros-y-gatos/,unotv,www.unotv.com,9,185
097720c23492144dd0ee22e3b1bb174c,¿Perdieron tu equipaje? Esto te deben pagar si viajas en avión,"El pasajero puede documentar sin costo hasta 15 o 25 kg de equipaje. Foto: ShutterstockCuando solemos viajar en avión pueden existir diversas inconsistencias o desconocimiento sobre nuestro equipaje, es por ello que, la Procuraduría Federal del Consumidor (Profeco) te informa qué debes saber si lo pierde la aerolínea.¿Qué ocurre si pierden el equipaje?En caso de que la aerolínea pierda el equipaje del pasajero debe hacerse responsable. Por destrucción o avería del equipaje de mano, el pasajero debe ser indemnizado con 6 mil 759 pesos y por pérdida o avería de equipaje facturado 12 mil 673 pesos.¿Cuánto puedes subir de equipaje al avión?El pasajero puede documentar sin costo hasta 15 o 25 kg de equipaje, según la capacidad de la aeronave; así como dos piezas de equipaje de mano que en conjunto no excedan 10 kg, siempre que sus dimensiones no sean mayores a 55 cm de largo, 40 cm de ancho y 25 cm de alto.En caso de exceso, de acuerdo con la capacidad disponible, la aerolínea tendrá derecho a solicitar pago adicional. Cuando el pasajero decida viajar sin equipaje, la aerolínea puede ofrecer en su beneficio tarifas preferenciales.Cada pieza, maleta o bulto de equipaje debe contar con un talón que contenga la información que establecen las Normas Oficiales Mexicanas aplicables, con dos partes, a modo de comprobante: una para el pasajero y otra adherida al equipaje.En servicio aéreo internacional, la documentación de equipaje queda sujeta, en su caso, al tratado internacional aplicable.¿Qué pasa con las mascotas?Deben ser tratados de forma humanitaria con medidas que disminuyan su tensión, sufrimiento, dolor y producción de traumatismos durante la movilización, señalan las leyes de Aviación Civil y Federal de Protección al Consumidor.Conoce tus obligaciones como pasajeroDe acuerdo con la Profeco, debes tomar en cuenta lo siguiente al viajar en avión:Procura llegar a tiempo al aeropuerto y documentar con anticipación tu equipajeRecuerda que no podrás transportar explosivos (detonadores, granadas, minas y productos pirotécnicos); líquidos y cargas de gas (disolventes, pegamentos y cargas para encendedores); productos industriales o artículos domésticos (blanqueadores o aerosoles) y armas de fuego, por mencionar algunosSi tu equipaje excede el peso establecido, la aerolínea te solicitará un pago adicional. Para que esto no suceda, te invitamos a que compruebes el peso de tu equipaje en las Básculas del Consumidor, ubicadas en los módulos de asesoría e información permanentes del Aeropuerto Internacional de la Ciudad de México (AICM)Foto: Shutterstock.¿Qué artículos puedo llevar en el equipaje de mano?Lista de objetos que están permitidos en equipaje de mano:Zapatos de tacónCortauñasAparatos electrónicos pequeños (teléfono, mp3, Tablet)Materiales de lecturaInhaladorMientras que, una de las preguntas frecuentes es ¿puedo llevar plancha de cabello en equipaje de mano? y la respuesta es sí, la plancha y el secador de cabello están permitidos, se pueden dejar en la maleta, aunque al pasar por el control de seguridad es probable que te pidan sacarlos y colocarlos en una bandeja, así como el resto de aparatos electrónicos.¿Qué pasa con los líquidos?Entre los objetos que sí puedes llevar en cabina son los siguientes líquidos, pero toma en cuenta que sólo en envases de hasta 100 ml, no de más cantidad, pues los tendrás que documentar y máximo deben acumular un litro.Protectores solaresDesodorantes en gel o aerosolAceites de bañoLociones hidratantesPasta de dientesEnjuague bucalDesmaquillanteTónicosLociones de limpieza facialGlossBase líquidaShampooAcondicionadorJabón en gelRímel líquidoGel y spray para cabelloLíquido para lentes de contactoTE PODRÍA INTERESAR…VideoNegocios¡No más cobro extra por equipaje de mano! Profeco manda mensaje a aerolíneasTurismo¿Puedo viajar en avión si estoy embarazada? Esto dicen los expertosTurismo¿Irás a la playa en Semana Santa? Esto te cuesta viajar a las más cercanas de CDMX",https://www.unotv.com/turismo/equipaje-al-viajar-en-avion-cuanto-puedes-subir-y-que-pasa-si-lo-pierden/,unotv,www.unotv.com,6,321
