uid,headline,text,url,newspaper_uid,host,headline_tokens,text_tokens
66a36f2173ab1e005acd4e65c2efb55d,"Gomita, Edgar Vivar y Julio Preciado: famosos que se han hecho bypass","Para algunos famosos, el bypass ha mejorado su condición, otros lidiaron con problemas de salud después de esta operación. Foto: GettyImagesVarios son los famosos que se han sometido a un bypass gástrico para combatir el sobrepeso. Si bien algunos han recurrido a este tipo de cirugía por vanidad, otros lo han hecho por mantener la salud.Aracely Ordaz, “Gomita”, no ha tenido reparos en mostrar cómo ha sido el antes y el después de su figura tras un bypass. La cantidad de kilos que llegan a perder las celebridades con esta práctica es considerable.Por vanidad o por salud: famosos que se han hecho bypass“Gomita”Aracely Ordaz es una más de las famosas que han hablado abiertamente de las cirugías estéticas a las que se ha sometido, y ahora que fue intervenida con un bypass gástrico, presumió los cambios que ha logrado con la publicación de varios videos en las redes sociales.La que fuera estrella del programa Sabadazo compartió que gracias al procedimiento bajó 13 kilos. “En serio, soy otra”, expresó la influencer cuando habló de la cirugía que se practicó en otro país.Ver másEdgar VivarMás por salud que por estética, el intérprete del Señor Barriga y Ñoño en “El Chavo del 8” recurrió a una cirugía bariátrica que lo ayudó a bajar de peso. De 168 kilos pasó a 68.A pesar de los resultados, el actor se enfrentó a problemas de salud después de la operación. Como él mismo lo contó, tuvo dificultades con la absorción de hierro, que lo llevaron a presentar anemia.Ver másS M I L E !!!! pic.twitter.com/32M6XRX2iV— Edgar Vivar (@varedg) October 11, 2021Rubén CerdaEl actor, que es recordado por su papel de Gordonio en “Cero en conducta”, consiguió bajar 100 kilos por someterse a la misma cirugía que estos famosos.Con el bypass pudo darle batalla a su problema de diabetes con altos niveles que padecía, y por el que estuvo al borde de un coma diabético.Cerda llegó a pesar poco más de 200 kilos y, además del bypass, modificó sus hábitos alimenticios.Ver másJulio PreciadoEl que fuera vocalista de la Banda el Recodo perdió 40 kilos después del bypass. Se sometió a este tratamiento un año después de que recibiera un trasplante de riñón.El cantante llegó a tener problemas para caminar debido al sobrepeso.Ver másSheylaLa actriz pudo bajar más de 60 kilos gracias a la cirugía, y a partir de su cambio físico ha tenido que llevar una dieta balanceada y hacer ejercicio.Sheyla llegó a compartir que, después del tratamiento, come de cuatro a cinco veces al día pequeñas porciones de comida, y todos los días corre de seis a siete kilómetros.Ver másTE PODRÍA INTERESAR…De Eduardo Yáñez a la “Tigresa”: top 5 de famosos que han explotado contra la prensa y hasta propinado golpesVideoNo sólo han sido Belinda y Nodal: 10 parejas de famosos que se llevaban añosDe Jenni Rivera a Octavio Ocaña: famosos que han muerto trágicamente",https://www.unotv.com/entretenimiento/gomita-edgar-vivar-y-julio-preciado-famosos-que-se-han-hecho-bypass/,unotv,www.unotv.com,8,228
99635a76354873e63214638fa0414679,¿Qué es una persona física y por qué declara impuestos?,"Persona física: ¿qué es y por qué declara impuestos? Foto: Getty ImagesEn abril, las personas físicas presentan su declaración anual ante el Servicio de Administración Tributaria (SAT), pero no sabes ¿qué es eso y por qué debes hacer la declaración? Unotv.com te lo explica.¿Qué es una persona física?El portal del SAT explica que una persona física es un individuo que realiza cualquier actividad económica ya sea vendedor, comerciante, empleado, profesionista, etc., que tiene derechos y obligaciones. Es decir, es toda aquella persona que recibe ganancias por la actividad laboral que realiza.Las personas físicas realizan actividades económicas. Foto: ShutterstockEntre algunas características más importantes se encuentran que puede contar con doble nacionalidad, adquiere obligaciones fiscales al cumplir la mayoría de edad o ha comenzado a trabajar en el mercado formal y para ello uno debe registrarse como persona física ante el SAT para cumplir con esta obligación.Las personas físicas pueden recibir financiamientos, créditos o préstamos, de acuerdo a lo que perciban en su salario y al historial crediticio que cada persona ha creado. Ahora que sabes qué es una persona física vamos con la siguiente duda:¿Por qué debo de hacer una declaración?La declaración ante el SAT tiene como finalidad saber sobre la situación fiscal de las personas físicas por parte de la autoridad fiscal, para poder establecer el impuesto que deben de pagar, aunque se puede dar el caso que se pagaron contribuciones de más y entonces es el SAT quien debe devolvérselo al contribuyente.Las personas físicas deben presentar su declaración anual. Foto: freepikEn otras palabras, la declaración reúne todos los pagos obligatorios que las personas físicas deben hacer ante el Estado, la cantidad y la forma que señalan las leyes, como la Constitución, en la cual se establece la obligación de los mexicanos de contribuir para el gasto público del país, mediante el pago de impuestos.¿Cuándo hacen la declaración anual las personas físicas?Hayan obtenido ingresos por prestar servicios profesionalesRentaron bienes inmueblesRealizaron actividades empresarialesObtuvieron beneficios por la enajenación y adquisición de bienesSi percibieron ganancias por interesesSi recibieron ingresos mayores a 400 mil pesos durante el añoLos que recibieron ingresos de dos patrones,Quienes percibieron ingresos por liquidación, indemnización, pensión o jubilaciónQuienes cobran rentas de algún inmuebleQuienes hayan ganado algún premio¿Qué pasa si no haces tu declaración anual?Debes saber que para las personas físicas el 30 de abril es muy importante porque es la fecha límite para que puedan presentar la declaración anual de impuestos ante el SAT, documento oficial en el que los contribuyentes informan de sus operaciones realizadas en el año que finalizó.Ver másPreséntala aquí: https://t.co/zSKmrM6FAJ pic.twitter.com/rYIVKs5TPR— SATMX (@SATMX) March 31, 2022El SAT exige este reporte para que las personas físicas informen sobre sus operaciones como contribuyente para que como autoridad fiscal incremente la recaudación pública. Para los contribuyentes es de suma importancia, pues permite conocer el desempeño de su empresa o actividad económica en la que se desenvuelve.Ver más#Declara2021¡Ya es 1 de abril!¡Presenta tu Declaración Anual 2021 de #PersonasFísicas!Hazlo desde tu computadora, no necesitas acudir a nuestras oficinas.Declara aquí: https://t.co/nKTAHUsQYI pic.twitter.com/fFGIi1bkyu— SATMX (@SATMX) April 1, 2022TE PUEDE INTERESAR: ¡Ojo! Ésta es la fecha y hora límite para presentar tu declaración anual de personas físicas ante el SATAsí que estas son las razones por las que todas las personas físicas tienen que cumplir con sus obligaciones fiscales y si no lo hacen, pueden hacerse acreedoras a multas por no presentar su declaración anual en tiempo y forma y por cada una de las obligaciones incumplidas.¿Cuáles son las multas si no haces tu declaración?Las comunes van desde los mil 400, hasta los 17 mil 370 pesosPor no presentar declaración anual de los mil 400 a los 34 mil 730 pesosSi son fuera de plazo que van de los 14 mil 230 a los 28 mil 490 pesosVer más¿Tienes dudas sobre tu Declaración Anual 2021 de #PersonasFísicas?Comunícate con nosotros a MarcaSAT 55 6272 2728 y al Chat uno a uno.#Declara2021 pic.twitter.com/hLIha6bAtN— SATMX (@SATMX) March 31, 2022Las multas deben ser pagadas por las personas físicas en tiempo y forma o se hacen acreedoras a sanciones adicionales. Además, no solo con multas se pueden ver afectadas en caso de impagos, retrasos o errores en la declaración anual, pues es posible que esto perjudique el historial crediticio.Te recomendamos:VideoSAT te apoya a presentar tu declaración anual este 2022; ve cuándo es la fecha límiteVideo¿Vas a hacer tu declaración anual? Ve quiénes deben presentarla ante el SAT¿Necesitas tu Constancia de Situación Fiscal? SAT informa que sólo se podrá obtener de esta manera ",https://www.unotv.com/negocios/persona-fisica-que-es-y-por-que-declara-impuestos/,unotv,www.unotv.com,4,386
7003c4d1c5eba29328b9927fb6ebf45c,ONU suspende a Rusia del Consejo de Derechos Humanos,"Ambos países han conversado regularmente por videoconferencia. Foto: Getty ImagesLa Asamblea General de las Naciones Unidas suspendió este jueves a Rusia del Consejo de Derechos Humanos del organismo por haber invadido Ucrania.De los 193 miembros de la asamblea, 93 votaron a favor, 24 en contra y 58 se abstuvieron, lo que sugiere un debilitamiento de la unidad internacional contra Rusia. Es la segunda suspensión de un país del consejo, después de Libia en 2011.Ucrania agradece la suspensión de RusiaUcrania expresó su agradecimiento por la suspensión de Rusia del Consejo de Derechos Humanos y afirmó que a los “criminales de guerra” no les cabe estar representados en esa instancia de la ONU.“Los criminales de guerra no tienen lugar en los organismos de la ONU a cargo de la protección de los derechos humanos”, dijo el canciller ucraniano, Dmytro Kuleba, en Twitter.“Agradecemos a todos los Estados miembro que apoyaron la resolución [de la Asamblea General de Naciones Unidas] y se pusieron del lado correcto de la historia”, agregó.Ver másRussia’s rights of membership in the UN Human Rights Council has just been suspended. War criminals have no place in UN bodies aimed at protecting human rights. Grateful to all member states which supported the relevant UNGA resolution and chose the right side of history.— Dmytro Kuleba (@DmytroKuleba) April 7, 2022Por su parte, el Kremlin lamentó la suspensión de Rusia en el Consejo de Derechos Humanos, advirtiendo de que Moscú “seguirá defendiendo sus intereses por todos los medios legales”.“Lo lamentamos y seguiremos defendiendo nuestros intereses por todos los medios legales y explicándonos”, afirmó el portavoz del presidente Vladimir Putin, Dmitri Peskov, al canal privado británico Sky News.Sigue la guerraHace unos días, el secretario general de la Organización del Tratado del Atlántico Norte (OTAN), Jens Stoltenberg, dijo que los asesinatos de civiles en Bucha, Ucrania, son “horribles”.Las declaraciones del secretario de la OTAN se pronuncian después de que se difundieran horribles imágenes de Bucha, ciudad ucraniana recuperada de manos de las fuerzas rusas.Las negociaciones entre Rusia y Ucrania continúan, sin embargo, no se ha llegado a un acuerdo para terminar con el conflicto.TE PODRÍA INTERESAR…Rusia vs Ucrania en vivo, últimas noticias hoy 7 de abril de 2022Rusia acusa a Ucrania de cambiar exigencias de negociación; ve cuálesSólo con pocas excepciones: España se despide del cubrebocas en interiores",https://www.unotv.com/internacional/asamblea-general-de-la-onu-suspende-a-rusia-del-consejo-de-derechos-humanos/,unotv,www.unotv.com,6,217
48a4949bcc65f544e842568e45af1011,"Ruta Meilutyte, campeona olímpica, nada en “lago de sangre” frente a embajada Rusa","La nadadora lituana Ruta Meilutyte protagonizó una protesta contra la invasión de Rusia a Ucrania.La nadadora lituana Ruta Meilutyte, campeona olímpica en Londes 2012, protagonizó una singular protesta contra la invasión de Rusia a Ucrania al nadar en un “lago de sangre” a lado de la embajada rusa en su país.La nadadora Ruta Meilutyte protagonizó una impactante protesta al nadar en un lago rojo, que da la impresión de estar teñido de sangre. En realidad se trata de un colorante biológico que derramó en un estanque situado justo al lado de la embajada rusa en la ciudad de Vilna, capital de Lituania.En las imágenes distribuidas se ve un lago que está “ensangrentado”. La nadadora utilizó tinte ecológico para teñir el agua y simbolizar la sangre derramada en Ucrania y que ya se consideran crímenes de guerra.Ver másSwimming ThroughThe performance “Swimming Through” is a call for action in support of the Ukrainian people who are facing genocide committed by Russia. pic.twitter.com/LuXRFms2c4— Rūta Meilutytė (@MeilutyteRuta) April 6, 2022En su cuenta de Twitter, Ruta Meilutyte explicaba de qué se trata de un llamado a la acción “en apoyo del pueblo ucraniano que enfrenta el genocidio cometido por Rusia”.También simboliza “la necesidad de que continúe la lucha” del pueblo ucraniano contra sus invasores y sostiene que “es crucial que sigamos activos difundiendo información veraz, protestando, haciendo donativos y presionando a nuestros gobiernos para que emprendan acciones”.¿Quién es Ruta Meilutyte?Ruta Meilutyte ganó el oro en Londres 2012. Foto: AFPRuta Meilutyte se proclamó campeona olímpica de los 100 metros pecho en los Juegos de Londres, con 15 años, antes de proclamarse campeona de Europa en categoría júnior.Meilutyte también ganó los títulos mundial y europeo y batió las marcas del hectómetro y de los 50 metros pecho en los años siguientes. Su dominio no se prolongó mucho y en 2018 dejó de competir, aunque recientemente anunció su vuelta a la natación.Ruta, como se la conoce en su deporte, es una de las deportistas no ucranianas que más ha mostrado su oposición a la invasión rusa.Te recomendamos:¿Quién es Deshaun Watson? El jugador de Cleveland Browns que enfrenta 22 demandas por abuso sexualSólo para políglotas: ¿Qué dice el himno de la Champions?Día Internacional del Deporte: ¿cuál serías según tu personalidad?",https://www.unotv.com/deportes/ruta-meilutyte-nadadora-lago-de-sangre-rusia-ucrania/,unotv,www.unotv.com,9,200
2cea7c638f70e65957319deec5e6a89f,La danza de los huracanes: ¿qué es el efecto Fujiwhara y qué tan destructivo es?,"El “efecto Fujiwhara” consiste en el encuentro de dos huracanes ¿qué tan peligroso es? / Foto: Getty ImagesEl efecto Fujiwhara es más común de lo que se piensa, el cual consiste en dos huracanes que giran en la misma dirección hasta pasar lo suficientemente cerca el uno del otro como para tener el potencial de causar un mega ciclón, aunque sus efectos no son tan catastróficos y no requerirían mayores medidas de prevención.Ver másForget #Fujiwhara effect, #TropicalStormMarco is very likely contributing to the extremely favorable environment #TropicalStormLaura is in now, by enhancing the ridging over the western Atlantic. pic.twitter.com/2UBxx1qPwS— Greg Postel (@GregPostel) August 23, 2020En 2020 se presentó la posibilidad de un Efecto Fujiwhara en el Océano Atlántico.¿Qué es el efecto Fujiwhara?El Servicio Meteorológico Nacional (NWS, por sus siglas en inglés) de Estados Unidos definió al efecto Fujiwhara y aclara que un ejemplo de esto se presentó en 2017 cuando Irwin y Hilary se encontraron en el Pacífico Este.“Cuando dos huracanes que giran en la misma dirección pasan lo suficientemente cerca uno del otro, comienzan una intensa danza alrededor de su centro común”.National Weather Service (NWS)Las dos posibilidades cuando dos huracanes se encuentranLas autoridades meteorológicas estadounidenses aclaran que si un huracán es mucho más fuerte que el otro, el más pequeño lo orbitará y finalmente chocará contra su vórtice para ser absorbido.Dos tormentas más cercanas en fuerza pueden gravitar una hacia la otra hasta alcanzar un punto común y finalmente fusionarse, o simplemente giran entre sí por un tiempo antes de seguir con sus propias trayectorias.¿Es peligroso el efecto Fujiwhara?El propio NWS precisa que “en raras ocasiones, el efecto Fujiwhara es aditivo cuando los huracanes se juntan, resultando en una tormenta más grande en lugar de dos pequeñas”, por lo que un “superhuracán” es posible, pero con probabilidades nulas.Ver másLoop animation of the Fujiwhara effect between #Vernon & #93S. Vernon went from this powerful storm to this now sheared & blob mess. #Tropics pic.twitter.com/OjcsfeykYP— Vortix (@VortixWx) February 27, 2022En 2022, Vernon y 93S generaron un efecto Fujiwhara al pasar cerca uno del otro.En cuanto a los ciclones extratropicales, o los ciclones de latitud media, cuando están aproximadamente a 2 mil kilómetros de distancia el uno del otro, entonces participaran en una interacción con efecto Fujiwhara.¿Por qué recibió este nombre?Sakuhei Fujiwhara, meteorólogo japonés hizo de su apellido un homónimo para el efecto Fujiwhara. Este científico investigó y estudió entre 1921 y 1923 a los vórtices ciclónicos que se originan en el océano.Como parte de su investigación, realizó numerosos experimentos y observaciones descubriendo que bajo ciertas circunstancias y si están muy cerca, dos ciclones pueden orbitar entre sí y eventualmente converger en el centro de su rotación.El experimento de la piscina de turbinasDurante la estancia en Noruega del Dr. Fujiwhara, al lado de su mentor, el fundador de la meteorología moderna Vilhelm Bjerknes; construyó una piscina con turbinas en el fondo, con la intención de replicar la rotación de los ciclones.El experimento consistía en lo siguiente: al apagar las turbinas se formaban vórtices, estos orbitaban alrededor de un punto central que se formaba entre ellos o giraban libremente, y en algunos casos al variar su velocidad se acercaban entre sí logrando fusionarse.Casos documentados del efecto FujiwharaSegún la Agencia de Meteorología Japonesa, el efecto Fujiwhara es más recurrente durante la temporada de tifones sobre el Pacífico occidental, cómo fue el caso entre el tifón Noru y la tormenta tropical Kulap en 2017, mismo año del encuentro de Irwin y Hilary.Según observaciones del Centro Nacional de Huracanes, en el Océano Atlántico durante el año 1995, el huracán Iris tuvo interaccón con el huracán Humberto y absorbió a la tormenta tropical Karen.Un caso “mexicano”La tenue presencia del efecto en la interacción de los ciclones tropicales Mario y Lorena, como mencionó el Dr. Jorge Zavala, coordinador del Servicio Meteorológico Nacional Mexicano, durante una conferencia de prensa, influyo en la intensificación del huracán Lorena, para después y por segunda vez, tocar tierra durante el día de ayer 20 de septiembre a las 23:00 hrs, en la localidad de La Ventana, Baja California Sur.TE PODRÍA INTERESAR…VideoDona tu cuerpo a prácticas o investigación científica; la UNAM aclara dudasVideo¿Cómo cambia la vida cuando te diagnostican diabetes?Video¿Quieres aprender skate, longboard y patinaje? En estos parques dan clases gratuitas",https://www.unotv.com/ciencia-y-tecnologia/efecto-fujiwhara-que-es-y-que-tan-destructivo-puede-ser/,unotv,www.unotv.com,6,376
ea404227362ac978a6ff8847b3baea00,"¿Es apto para niños? Conoce Poppy Playtime, el aterrador juego de Huggy Wuggy","Poppy Playtime es uno de los videojuegos de moda gracias al monstruo Huggy Wuggy / Foto: Twitter (@Dein_Stein)Poppy Playtime, mejor conocido por su protagonista Huggy Wuggy, es un videojuego de terror y supervivencia desarrollado y lanzado por MOB Games, estrenado el 12 de octubre de 2021 para Microsoft Windows, el cual ha cobrado popularidad entre las niñas y niños mexicanos.¿Qué es Poppy Playtime?La descripción oficial de Poppy Playtime no engaña a los jugadores, pues advierte desde el inicio que es un juego de terror con la presencia de “juguetes vengativos” que tratarán de atrapar al jugador.‘Deberás sobrevivir en esta aventura de terror y puzles. Intenta no caer ante los vengativos juguetes que te esperan en la fábrica abandonada. Utiliza tu mochila de agarre para hackear circuitos eléctricos o alcanzar objetos desde lejos. Explora las misteriosas instalaciones y no dejes que te capturen”.Valve¿Cómo comprar el juego y cuánto cuesta?Este juego es exclusivo para PC y fue lanzado con un precio aproximado de 3.99 euros, es decir, 87.69 pesos mexicanos. Actualmente, el juego de Huggy Wuggy se vende por 4.99 dólares en la página oficial de Steam (plataforma digital de videojuegos desarrollada por Valve), lo que equivale a 100.62 pesos.Hasta el momento, Poppy Playtime no está disponible para consolas como XBox Series S/X o One, Playstation 5 ni Nintendo Switch, aunque se especula que las empresas podrían anunciar en 2022 su lanzamiento para sus plataformas debido a su popularidad.¿Poppy Playtime es un videojuego para niños?Al tratarse de un juego independiente, Poppy Playtime no tiene una clasificación definida, por lo que no existe una restricción de edad oficial para los jóvenes aficionados de Huggy Wuggy. En caso de llegar a consolas, podría comenzar a tener recomendaciones de uso.A pesar de la naturaleza terrorífica del personaje principal de este videojuego, el director ejecutivo de Enchanted Mob/Mob Games, Zach Belanger, recalcó en noviembre de 2021 que se trata de un juego adecuado para mayores de 8 años.“Sólo hay estos juguetes grandes, malvados y aterradores. No es espantoso, no es sangriento, no es combustible para pesadillas”Zach Belanger¿Cuáles son las clasificaciones para videojuegos?La Junta de Clasificación de Software de Entretenimiento (ESRB, por sus siglas en inglés) emite las clasificaciones de videojuegos de la siguiente manera:EveryoneEveryone +10TeenMature +17Adults only +18Al no tener elementos vulgares ni sangre explícita, Poppy Playtime podría entrar en la categoría de Everyone +10 al contener violencia de caricatura o fantasía ligera, o Teen, por incluir violencia o temas insinuantes, así como una mínima cantidad de sangre, aunque esto no es oficial aún.¿Por qué existe preocupación por Poppy Playtime?En Reino Unido, autoridades y padres de familia emitieron una alerta porque los menores de edad quieren ejercer la misma violencia que Huggy Wuggy, personaje de Poppy Playtime, el cual amenaza al jugador con abrazarlo hasta quitarle el último aliento en una juguetería abandonada.La figura de este monstruo azul se ha vendido en múltiples tonalidades no sólo en Estados Unidos y Reino Unido, sino que también en México se ha puesto a la venta, causando sensación entre los niños y adolescentes de todo el mundo.Ver másNew doll, huggy wuggy, the protagonist of the horror game ""poppy playtime""😆 pic.twitter.com/EfyNgSFpdV— Chucky fan (@MarryLam3) April 7, 2022Desde el lanzamiento de Poppy Playtime, los padres de familia han alertado que los pequeños de la familia no deberían jugar este juego por su alto contenido violento y su mensaje perturbador, además de señalar que Huggy Wuggy puede producir pesadillas.TE PODRÍA INTERESAR…VideoAdicción a los videojuegos ya es una enfermedad según la OMS, ve señales de alerta¿Será? Sonic se ubica como el personaje más popular de los videojuegosRescatan a niño enganchado con videojuego “Free Fire” en Oaxaca",https://www.unotv.com/ciencia-y-tecnologia/poppy-playtime-conoce-el-juego-de-huggy-wuggy-y-que-clasificacion-es/,unotv,www.unotv.com,9,322
3b2a55182058b5a0056dcd25867291cd,Campañas electorales actuales tienen un mayor impacto local que nacional,"Iniciaron las campañas electorales en seis estados de la República Mexicana para elegir a gobernadores estatales; los partidos políticos trabajan para buscar resultados favorables y expandirse en los territorios.Los estados que se encuentran en campaña para la elección de gobernador son:AguascalientesDurangoHidalgoOaxacaQuintana RooTamaulipasCabe recordar, que el estado de Durango también elegirá a 39 presidentes municipales, 39 sindicaturas y 327 regiduríasEn Quintana Roo también se elegirán 25 diputaciones, además en el estado de Chiapas habrá elecciones extraordinarias este día.Ante la diversidad y las alianzas de los partidos que buscan las gubernaturas, el analista político Jesús Silva-Herzog señala:“El espacio electoral es mucho más volátil de lo que podríamos haber dicho a principios del año”.Jesús Silva-Herzog, analista políticoSi tiene un impacto lo que está pasando a nivel nacional, pero, sobre todo, de lo que hablamos es del efecto tanto de las candidaturas como de las campañas que se están realizando de manera regional.Ante un panorama que muchos piensan que está enfocado en la política nacional en estas elecciones, señala que hay que recordar que está dirigida a los sectores locales.“Se trata de procesos en los que, lo que cuenta es la dinámica local, la dinámica regional y en donde importan los candidatos en específico y lo que sucede en estas campañas que son relativamente breves”.Jesús Silva-Herzog, analista políticoTE PODRÍA INTERESAR…Bebé nace con parapagus dicefálico: tiene 2 cabezas, 3 manos y 2 corazonesVideoCorte invalida prohibición de 10 años para que exfuncionarios trabajen en iniciativa privada“Completamente inquietante”: Madonna preocupa a sus fans con un video antes de los Grammy 2022",https://www.unotv.com/opinion/jesus-silva-herzog/importa-mas-la-dinamica-regional-en-las-campanas-electorales-actuales/,unotv,www.unotv.com,7,113
